doi,author,title,year,abstract,journal
10.1075/jhl.22001.koc,Petr Kocharov,Anticausatives in Classical Armenian,2022,"
The present study contributes to the description of the coding of anticausatives and causative-anticausative
					alternation in Classical Armenian based on conventional typologically-oriented questionnaires and a dataset of verbs attested in
					the Armenian translation of the Bible. The synchronic evidence is then analyzed from a diachronic perspective with an outlook on
					modern varieties of Armenian and the Proto-Indo-European reconstruction.
It is argued that discriminating between the derivational and inflectional tiers allows for a better explanation
					of the morphological links between the patterns used to code causative-anticausative alternation in verbs of different semantic
					types. According to preliminary quantitative estimations, the overall valency orientation of Classical Armenian is dominated by a
					nondirected equipollent coding strategy. Altogether, when coded by transitivizing pairs, causative-anticausative alternation shows
					preference for noncausal verbs of the a-conjugation, the paradigm of which typically combines equipollent
					perfective forms with labile imperfective ones.
An improved descriptive model enables a better cross-linguistic alignment of coding patterns as illustrated by
					comparing Classical Armenian to other cognate languages. Classical Armenian provides additional evidence on the typologically
					common split in the coding of causative-anticausative pairs. Whereas the transitivizing and equipollent (and marginally
					suppletive) patterns are diachronically stable within the prehistory of Armenian, the labile strategy constitutes a major
					innovation typical for the imperfective part of the verbal paradigm.
",JOURNAL OF HISTORICAL LINGUISTICS
10.1075/jhl.21046.law,James Law,Regularity of semantic change  in Romance anatomical terms,2022,"
While semantic change is notoriously idiosyncratic, cross-linguistic evidence suggests some general trends in the
					directions and mechanisms of semantic shifts. Notable among these are trends applying to the target domain of the human body, a
					domain that has received considerable attention due to its universality. However, broad surveys of many languages risk missing
					significant details. Data from the Dictionnaire étymologique et cognitif des langues romanes (DECOLAR) on the
					etymologies of terms for 97 body parts in 14 Romance languages calls some proposed trends into question. In particular,
					counterexamples are found to a supposed unidirectional shift from visible parts to the wholes that include them. Analysis of
					individual changes reveals contextual factors that can cause a lexical trend to not apply. The findings contribute to a more
					complex model of metaphorization and metonymization, the primary processes involved in lexical semantic change.
",JOURNAL OF HISTORICAL LINGUISTICS
10.1075/jhl.21033.san,"Israel Sanz-Sánchez, María Irene Moyna",Children as agents of language change,2022,"
This paper explores the operation of child language acquisition as a critical factor in some forms of language change. It proposes a sociohistorical model that incorporates the potential for young children to function as linguistic agents in certain environments, characterized by unpredictable variation in the input, lack of normative mechanisms, and the possibility for the emergence of peer networks among children. The model is then applied to explain a well-documented but poorly understood phonological change in the history of Latin American Spanish: the simplification of the system of sibilants in 16th-century Colonial Spanish. This change was nestled in ecological environments characterized by intense contact among L1 and L2 speakers of several varieties of Iberian and non-Iberian languages, as well as the rapid breakdown and reshaping of social networks. We argue that, in the absence of strong normative pressures, the advantages of certain options for early acquisition were crucial in the eventual creation and generalization of a new sociolinguistic norm. This study is methodologically innovative in that it combines not just archival evidence and sociohistorical information, but also present-day acquisitional data. The latter offers a piece often missing in sociohistorical accounts of language change.
",JOURNAL OF HISTORICAL LINGUISTICS
10.1075/jhl.21008.bea,Rosemary G. Beam de Azcona,The historical dialectology of stative morphology in Zapotecan,2022,"
This paper updates the reconstruction of the stative aspect prefix in Proto-Zapotecan as *n- and tracks
                    innovations in stative marking. An early change is proposed to have deleted preconsonantal nasals, rendering segmentally unmarked
                    stative forms of consonant-initial verbs in varieties of Zapotec then spoken in and around the city of Monte Albán. Contact with
                    Chatino may be a factor in the retention of preconsonantal *n in Zapotec varieties spoken to the south. A fuller stative prefix,
                    usually *na-, arose later from a grammaticalized form of the stative-marked copula (Munro
                        2007; Uchihara 2021). *na- is more productive than *n- and
                    provides the basis for a new proposed “Eastern Zapotec” genetic grouping. However, the isogloss for *na- crosscuts the earlier
                    isogloss for preconsonantal nasal deletion, showing that any model of Zapotecan linguistic history needs to address not only
                    divergence but also convergence. Ethnohistorical and archaeological evidence provide a social context to the linguistic changes
                    discussed.
",JOURNAL OF HISTORICAL LINGUISTICS
10.1075/jhl.21026.mei,Barbara Meisterernst,The negative cycle in Chinese,2022,"
The present discussion proposes that renewal processes in the domain of negation manifest themselves predominantly
                    in the change from bi-morphemic, synthetic negation to analytic negation neg+aux by introducing a new auxiliary verb as
                    verbal head. Some of these new verbs may subsequently be merged with the negator resulting into new bi-morphemic negation. The
                    proposed analyticization process accounts for different kinds of complex negation, including aspectual and modal negation, the
                    copula and negative focus markers. I propose a unified mechanism for the morpho-syntactic processes, which change the system of
                    negation in Chinese. Two morpho-syntactic factors contribute to this particular grammaticalization process of Chinese: (1) the
                    diachronically consistent head initial word order within the functional and the lexical (CP/vP) domains (with the
                    exception of sentence-final particles); and (2) the morpho-phonological rule that negation has to attach directly to aux,
                    i.e., to a weak verbal head. Based on particularly the second constraint, I propose that only the combination
                        neg+aux
mod leads to the emergence of new fused negators constituting the head of a Negative/Modal phrase,
                    i.e., a negative phrase (NegP) with modal features. The renewal process of the verbal heads of bi-morphemic negation is caused by
                    semantic bleaching and an increasing intransparency of the negator which triggers the grammaticalization of new (often defective)
                    lexical verbs via upward movement from the lexical to the functional domain. It accounts for the grammaticalization of the
                    aspectual negator wèi
未, of the
                    (negative) copula of Early Archaic Chinese into focus marker and complementizer, and for the replacement of synthetic by analytic
                    modal negation neg
mod > neg+aux
mod.
",JOURNAL OF HISTORICAL LINGUISTICS
10.1075/jhl.21016.kis,"Lena Borise, Katalin É. Kiss",The emergence of conjunctions  and phrasal coordination in Khanty,2022,"
Prior to widespread contact with Russian, Khanty (Uralic; Finno-Ugric) did not have overt conjunctions or phrasal
          coordination. Instead, Khanty texts from the late 19th–early 20th centuries only include examples of conjunction-less clausal juxtaposition,
          which was used for both clausal and phrasal coordination. By comparing Khanty texts over the 20th century, we trace the emergence of overt
          conjunctions and coordination of phrasal constituents. We show that overt conjunctions first appeared in the context of clausal
          coordination, followed by coordination of smaller phrases. Based on novel elicitation data, we demonstrate that, in contemporary Khanty, (i)
          overt conjunctions are commonplace, (ii) coordinated clausal constituents may be derived via phrasal coordination or clausal coordination
          with conjunction reduction/ellipsis, but (iii) ellipsis of syntactic heads is banned (nouns & postpositions) or dispreferred (verbs).
          Based on this diachronic picture, we conclude that the coordination of phrasal constituents only emerged in Khanty once overt conjunctions
          became available. We derive this correlation from the Maximize On-line Processing principle (Hawkins
            2004), and show that this maxim, usually invoked in the context of speech planning and production, can be successfully applied to
          modelling language change.
",JOURNAL OF HISTORICAL LINGUISTICS
10.1075/jhl.21003.wan,"Florian Wandl, Darya Kavitskaya",On the reconstruction of contrastive secondary palatalization in Common Slavic,2022,"
Contrastive secondary palatalization is a feature typically associated with Slavic. However, this contrast is
                    present only in some contemporary Slavic languages, such as Ukrainian, Eastern Bulgarian, Russian, and Upper and Lower Sorbian.
                    Thus, a question arises as to whether the secondary palatalization contrast represents a Common Slavic inheritance, and how it
                    should be reconstructed. Providing such a reconstruction is important for the field of Slavic historical phonology, as well as for
                    the general understanding of the development of consonant inventories with palatal consonants and the development of secondary
                    palatalization contrasts in the world’s languages. By considering several historical scenarios, we show that /r/ : /rj/
                    is the only secondary palatalization contrast that can be reconstructed to a pre-stage common to all of Slavic. While pursuing the
                    reconstruction, we use supporting evidence from the typology of sound change and the typology of consonantal inventories in the
                    world’s languages, as well as relative chronology.
",JOURNAL OF HISTORICAL LINGUISTICS
10.1075/jhl.21020.chi,"Katia Chirkova, Zev Handel",Diachronic developments in fricative  + nasal sequences,2022,"
Through comparison of regular sound correspondences in three closely related Tibeto-Burman (TB) languages, Ersu,
                    Lizu, and Duoxu (collectively “ELD”), informed by external comparison with other TB languages and recent phonetic analyses of the
                    production of voiceless nasals, we reconstruct *fricative-nasal sequences in their common ancestor, Proto-ELD.
In the development of these historic clusters, two pathways of change can be recognized. Their difference lies in
                    the divergent relative phasing of velic and oral gestures in the original fricative-nasal sequences:


(i)

fricative weakening (from a tight cluster): *FN > N̥ > h̃ > x



(ii)

fricative strengthening (from a loose cluster): *F-n > *F-t > t > k or *F‑n > s



The different reflexes observed in Ersu, Lizu, and Duoxu represent different points along these two developmental
                    pathways. These reconstructions and pathways of development have implications for our understanding of both universal (phonetic)
                    and language-specific aspects of change in fricative-nasal sequences. The first pathway makes it possible to explore the process
                    of nasal devoicing beyond voiceless nasals so as to enrich our understanding of nasal devoicing in natural languages. The
                    co-existence of two opposite pathways of change, on the other hand, provides insights into the morphological and syllabic
                    structure of words with contiguous fricative-nasal sequences in ELD languages at different points in time – insights that may be
                    valuable in examining the history of other languages and language families beyond the ELD cluster.
",JOURNAL OF HISTORICAL LINGUISTICS
10.1075/jhl.20054.bos,"Sara Pacchiarotti, Koen Bostoen",Erratic velars in West-Coastal Bantu,2022,"
In this article, we present the first quantitative study of what we call multiple unconditioned reflexes (MUR) in
					Bantu, more specifically of Proto-Bantu velar stops *k and *g in the West-Coastal Bantu (WCB) branch of the Bantu language family.
					MUR, also known as “doubles reflexes” in Bantu studies, represent a situation where one and the same proto-sound has two or more
					reflexes in a given language which cannot be accounted for by phonological conditioning and/or lexical borrowing. This diachronic
					irregularity has been explained in Bantu historical linguistics, and Niger-Congo studies more broadly, by reconstructing either an
					additional series of consonants (phonemic merger) or a latent conditioning that went lost (phonemic split). We show that MUR
					should not be explained, but rather taken as an indicator of the same pervasive irregularity of sound change reported in other
					parts of the world that are highly multilingual and lack a neat overlap between distinct languages and communities. Along with
					widespread multilingualism, we assess lexical diffusion, substrate influence, and spread-over-spread events in Bantu language
					history as complementary explanations for the rise of MUR in WCB.
",JOURNAL OF HISTORICAL LINGUISTICS
10.1075/jhl.20044.ang,"Alessandro De Angelis, Giulia Bucci","
There sentences in extreme southern Italy",2022,"
Among the morpho-syntactic patterns by which Italo-Romance varieties code there sentences, a
					peculiar structure surfaces in extreme southern varieties, particularly in Salento and in southern Calabria: this involves an
					invariable 3rd person form of the outcome of habēre as the copula, with no agreement with the postcopular nominal, the
					so-called pivot. Even though this pattern is attested in other Romance languages too, it proves, however, to be peculiar, insofar
					as it hosts top-ranking definite NPs (especially 1st and 2nd person pronouns), which are generally disallowed within ‘to have’
						there sentences in the Romance varieties. In the present paper, we infer that this pattern depends on the
					contact with Italo-Greek, which displays similar constructions, with an invariant 3rd sg. form of ‘to have’, the lack of the
					proform and the pivot marked as accusative. However, a diachronic investigation reveals that neither the extreme southern
					Italo-Romance varieties nor Italo-Greek displayed in their Medieval stage a similar construction, since both of them exhibited the
					definiteness effect. Sociolinguistic factors can account for how the two systems influenced each other by ruling out the
					definiteness effect from the respective patterns at the end of the interference process.
",JOURNAL OF HISTORICAL LINGUISTICS
10.1075/jhl.21028.ama,"Patrícia Amaral, Zuoyu Tian, Dylan Jarrett, Juan Escalona Torres",Tracing semantic change in Portuguese,2022,"
This study uses word embeddings to investigate the semantic changes underlying the creation of two adversative connectives in Portuguese, porém and mas ‘but, however’. For porém, we chart its development from an original PP formed by a preposition with a causal meaning (por) and a demonstrative pronoun that referred anaphorically to a previous proposition (en(de)). For mas, we trace its change from an adverb meaning ‘more’. Adopting a distributional semantics approach, we use word embedding models trained on two corpora, the CIPM (Corpus Informatizado do Português Medieval, containing texts from the 12th–16th centuries) and COLONIA (containing texts from the 16th–20th centuries). We produce a measure of change based on the similarity scores of porém and mas with respect to words in relevant semantic categories in each corpus, representing the source and the target meanings. This paper, which constitutes the first computational study of semantic change in Portuguese, also discusses challenges and outlines steps to be taken into consideration when choosing embedding algorithms for small historical corpora.
",JOURNAL OF HISTORICAL LINGUISTICS
10.1075/jhl.20023.yan,Yuko Yanagida,The origin of dative subjects and psych predicate constructions in Japanese,2022,"
There is considerable literature on dative subject or non-canonical subject marking constructions in Japanese, and
					yet they have been studied mainly from a synchronic point of view. This paper investigates the diachronic dimension of
					non-canonical case marking constructions in Japanese. Following Yanagida and Whitman
						(2009), I assume that Old Japanese (700–800 A.D.) displays split active alignment. This paper argues that dative
					subjects arose as a byproduct of a change occurring from active-inactive to accusative alignment. A factor triggering this change
					was the reanalysis of some particular object experiencer predicates as intransitives due to the loss of the vestigial causative
					suffix associated with the predicate. Synchronically, these constructions involve a voice alternation of the type identified as
					the psych causative alternation by Alexiadou and Iordăchioaia (2014): object
					experiencer verbs behave parallel to causative verbs whereas alternating subject experiencer verbs behave parallel to
					anticausative verbs.
",JOURNAL OF HISTORICAL LINGUISTICS
10.1075/jhl.21019.kha,Geoffrey Khan,The change in the grammatical category of the copula in North-Eastern Neo-Aramaic,2022,"
North-Eastern Neo-Aramaic (NENA), which is a subgroup of dialects of vernacular Neo-Aramaic, exhibits considerable
					internal diversity. In this paper, I describe the diversity that exists in the form of the copula in this subgroup. The paradigms
					of the copula in the various dialects exhibit different degrees of convergence with verbal inflection. There is an areal
					progression in verbalization from the western periphery to the eastern periphery. The incipient verbalization of the copula can be
					correlated with semantic properties of the subject and the clause that would be expected typologically to be most compatible with
					verbal predicates. Close correlations, however, can be identified with the distribution of pronominal and verbal inflections of
					copulas in the languages with which the NENA dialects have been in contact in the region. It is likely, therefore, that the
					realization of the internal potential verbalization of the NENA copula was induced by language contact.
",JOURNAL OF HISTORICAL LINGUISTICS
